{
  "eventId": "019f8e2b-0021-7000-8000-00000000a021",
  "eventType": "ActionRequested",
  "schemaVersion": 1,
  "occurredAt": "2026-07-12T14:04:30.500Z",
  "source": "agent-service",
  "aggregateType": "Villager",
  "aggregateId": "019f8e2a-0000-7000-8000-0000000e1a2a",
  "correlationId": "019f8e2b-0001-7000-8000-c0de00000001",
  "causationId": "019f8e2b-0020-7000-8000-00000000a020",
  "payload": {
    "commandId": "019f8e2b-0021-7000-8000-00000000a021",
    "villagerId": "019f8e2a-0000-7000-8000-0000000e1a2a",
    "action": "craft",
    "params": { "item": "crafting_table" },
    "priority": 5,
    "timeoutMs": 30000
  }
}
