{
  "eventId": "019f8e2b-0010-7000-8000-00000000b010",
  "eventType": "ElectionStarted",
  "schemaVersion": 1,
  "occurredAt": "2026-07-08T19:00:00.000Z",
  "source": "government-service",
  "aggregateType": "Election",
  "aggregateId": "019f8e2a-0000-7000-8000-0000e1ec0001",
  "correlationId": "019f8e2b-0010-7000-8000-c0de0000e1ec",
  "causationId": null,
  "payload": {
    "electionId": "019f8e2a-0000-7000-8000-0000e1ec0001",
    "office": "mayor",
    "startsAt": "2026-07-08T19:00:00.000Z",
    "nominatingEndsAt": "2026-07-08T19:10:00.000Z",
    "endsAt": "2026-07-08T19:25:00.000Z"
  }
}
