{
  "eventId": "019f8e2b-0014-7000-8000-00000000b014",
  "eventType": "ElectionDecided",
  "schemaVersion": 1,
  "occurredAt": "2026-07-08T19:25:00.100Z",
  "source": "government-service",
  "aggregateType": "Election",
  "aggregateId": "019f8e2a-0000-7000-8000-0000e1ec0001",
  "correlationId": "019f8e2b-0014-7000-8000-c0de0000dec1",
  "causationId": null,
  "payload": {
    "electionId": "019f8e2a-0000-7000-8000-0000e1ec0001",
    "winnerCandidateId": "019f8e2a-0000-7000-8000-0000c0a10001",
    "winnerVillagerId": "019f8e2a-0000-7000-8000-0000000b2a44",
    "voteCounts": {
      "019f8e2a-0000-7000-8000-0000000b2a44": 12,
      "019f8e2a-0000-7000-8000-0000000d0009": 7
    },
    "totalVotes": 19
  }
}
